{
  "$schema": "https://json-schema.org/draft/2020-12/schema",
  "$id": "egopulse://schemas/v01-persistence-fixture-envelope/v0.1",
  "title": "V-01 Persistence and Recovery fixture envelope",
  "type": "object",
  "additionalProperties": false,
  "required": [
    "schemaVersion",
    "fixtureId",
    "category",
    "requirementRefs",
    "principal",
    "operation",
    "expected"
  ],
  "properties": {
    "schemaVersion": { "const": "v01-persistence-fixture/v0.1" },
    "fixtureId": { "type": "string", "minLength": 1 },
    "category": {
      "enum": ["valid", "invalid", "duplicate", "stale", "unauthorized", "recovery"]
    },
    "requirementRefs": {
      "type": "array",
      "minItems": 1,
      "items": { "type": "string", "minLength": 1 }
    },
    "principal": {
      "type": "object",
      "additionalProperties": false,
      "required": ["kind", "principalId", "authenticated"],
      "properties": {
        "kind": {
          "enum": [
            "FOUNDER",
            "LOCAL_USER",
            "DOMAIN_AUTHORITY",
            "RECOVERY_COORDINATOR",
            "BACKUP_COORDINATOR",
            "HARNESS_ADAPTER",
            "MODEL",
            "SYSTEM_PROJECTOR",
            "OTHER_OS_USER",
            "UNAUTHENTICATED"
          ]
        },
        "principalId": { "type": "string", "minLength": 1 },
        "authenticated": { "type": "boolean" }
      }
    },
    "startingState": { "type": ["object", "null"] },
    "operation": { "type": "object", "minProperties": 1, "maxProperties": 1 },
    "typedHistoryCompaction": { "type": "object" },
    "canonicalVectors": { "type": "object" },
    "expected": {
      "type": "object",
      "additionalProperties": true,
      "required": ["outcome", "businessWriteCount"],
      "properties": {
        "outcome": { "enum": ["ok", "replayed", "error", "held"] },
        "businessWriteCount": { "type": "integer", "minimum": 0, "maximum": 1 }
      }
    }
  }
}
