{"schemaVersion":"v01-persistence-fixture/v0.1","fixtureId":"persistence-duplicate-outbox-after-consumer-commit","category":"duplicate","requirementRefs":["C08-OUTBOX-02","QH-03"],"principal":{"kind":"DOMAIN_AUTHORITY","principalId":"verification-authority","authenticated":true},"startingState":{"messageId":"msg-artifact-verified-1","consumerCommitDurable":true,"sourceAckLost":true},"operation":{"consumeOutboxMessage":{"messageId":"msg-artifact-verified-1"}},"expected":{"outcome":"replayed","businessWriteCount":0,"replayed":true,"sameConsumptionReceipt":true,"consumerRevisionUnchanged":true}}
