{"schemaVersion":"v01-persistence-fixture/v0.1","fixtureId":"persistence-unauthorized-model-restore-cutover","category":"unauthorized","requirementRefs":["C08-SECURITY-01"],"principal":{"kind":"MODEL","principalId":"model:codex","authenticated":true},"startingState":{"restoreReportValid":true},"operation":{"cutoverRestore":{"recoveryPlanId":"recovery-1"}},"expected":{"outcome":"error","businessWriteCount":0,"errorCode":"PERSISTENCE_ERROR_CODE_PERMISSION_DENIED","activeStoreUnchanged":true}}
