{"schemaVersion":"v01-persistence-fixture/v0.1","fixtureId":"persistence-valid-cross-authority-consumption","category":"valid","requirementRefs":["C08-OUTBOX-01","QH-03"],"principal":{"kind":"DOMAIN_AUTHORITY","principalId":"verdict-authority","authenticated":true},"startingState":{"sourceDomain":"PERSISTENCE_DOMAIN_TASK","destinationDomain":"PERSISTENCE_DOMAIN_FOUNDER_VERDICT","messageId":"msg_task_8_verdict","consumerRevision":3},"operation":{"consumeOutboxMessage":{"messageId":"msg_task_8_verdict","idempotencyKey":"consume:msg_task_8_verdict"}},"expected":{"outcome":"ok","businessWriteCount":1,"consumerResultingRevision":4,"consumerStateEventInboxAtomic":true,"sourceAuthorityStoreDirectRead":false,"consumptionReceiptCreated":true}}
