{"schemaVersion":"v01-persistence-fixture/v0.1","fixtureId":"persistence-recovery-consumer-commit-before-ack","category":"recovery","requirementRefs":["C08-OUTBOX-04"],"principal":{"kind":"RECOVERY_COORDINATOR","principalId":"recovery-coordinator","authenticated":true},"startingState":{"consumerCommitDurable":true,"inboxReceiptDurable":true,"sourceAckLost":true},"operation":{"replayOutbox":{"sourceDomain":"VERIFICATION"}},"expected":{"outcome":"ok","businessWriteCount":0,"duplicateDeliveryDetected":true,"sameConsumptionReceiptReturned":true,"consumerBusinessWriteRepeated":false}}
