{"schemaVersion":"v01-persistence-fixture/v0.1","fixtureId":"persistence-recovery-backup-restore-revision-continuity","category":"recovery","requirementRefs":["C08-RESTORE-02","QH-07"],"principal":{"kind":"RECOVERY_COORDINATOR","principalId":"recovery-coordinator","authenticated":true},"startingState":{"backupWatermarks":{"TASK":20,"COLLABORATION":14,"VERIFICATION":5},"restoredWatermarks":{"TASK":20,"COLLABORATION":14,"VERIFICATION":5}},"operation":{"verifyRestoreCandidate":{"backupId":"backup-1"}},"expected":{"outcome":"ok","businessWriteCount":0,"domainRevisionContinuityVerified":true,"eventContinuityVerified":true,"outboxInboxContinuityVerified":true,"validForCutover":true}}
