{"schemaVersion":"v01-persistence-fixture/v0.1","fixtureId":"persistence-recovery-partial-migration-restore-preupgrade-set","category":"recovery","requirementRefs":["C08-MIGRATION-02"],"principal":{"kind":"RECOVERY_COORDINATOR","principalId":"migration-coordinator","authenticated":true},"startingState":{"preMigrationManifestVerified":true,"TASK":"MIGRATED","COLLABORATION":"FAILED","activeStoreSetCutover":false},"operation":{"recoverFailedMigration":{"preMigrationBackupId":"backup-preupgrade-1"}},"expected":{"outcome":"ok","businessWriteCount":0,"entireStoreSetRestored":true,"mixedSchemaSetActivated":false,"automaticDownMigration":false,"readModelRebuildRequired":true}}
