{"schemaVersion":"v01-persistence-fixture/v0.1","fixtureId":"persistence-unauthorized-recovery-coordinator-task-write","category":"unauthorized","requirementRefs":["C08-OWNER-01","QH-02"],"principal":{"kind":"RECOVERY_COORDINATOR","principalId":"recovery-coordinator","authenticated":true},"startingState":{"targetDomain":"TASK"},"operation":{"writeForeignAuthorityStore":{"targetAggregateId":"task-1","requestedStatus":"COMPLETED"}},"expected":{"outcome":"error","businessWriteCount":0,"errorCode":"PERSISTENCE_ERROR_CODE_PERMISSION_DENIED","taskStatusUnchanged":true,"coordinatorOwnsBusinessFact":false}}
