{"schemaVersion":"v01-persistence-fixture/v0.1","fixtureId":"persistence-recovery-outbox-commit-before-delivery","category":"recovery","requirementRefs":["C08-OUTBOX-03","QA-08"],"principal":{"kind":"RECOVERY_COORDINATOR","principalId":"recovery-coordinator","authenticated":true},"startingState":{"sourceEventCommitted":true,"outboxMessageCommitted":true,"deliveryAttempted":false},"operation":{"replayOutbox":{"sourceDomain":"TASK"}},"expected":{"outcome":"ok","businessWriteCount":0,"sameMessageIdReplayed":true,"newSourceBusinessEventCreated":false,"deliveryAttemptCount":1}}
