{"schemaVersion":"v01-persistence-fixture/v0.1","fixtureId":"persistence-recovery-restored-pending-outbox-delivered","category":"recovery","requirementRefs":["C08-BACKUP-03","C08-OUTBOX-03"],"principal":{"kind":"RECOVERY_COORDINATOR","principalId":"recovery-coordinator","authenticated":true},"startingState":{"backupContainsPendingOutbox":true,"messageId":"msg-pending-at-backup","consumerReceiptPresent":false},"operation":{"replayOutbox":{"sourceDomain":"ARTIFACT_METADATA"}},"expected":{"outcome":"ok","businessWriteCount":0,"sameMessageIdReplayed":true,"messageOmitted":false,"newSourceBusinessEventCreated":false}}
