{"schemaVersion":"v01-persistence-fixture/v0.1","fixtureId":"persistence-recovery-active-attempt-outcome-unknown-held","category":"recovery","requirementRefs":["C08-RECOVERY-02","C02-RECOVERY-01","QA-03","QH-05","QT-08"],"principal":{"kind":"RECOVERY_COORDINATOR","principalId":"recovery-coordinator","authenticated":true},"startingState":{"attemptStatus":"ATTEMPT_STATUS_RUNNING","harnessProcessMissing":true,"externalSideEffectOutcome":"UNKNOWN"},"operation":{"reconcileActiveAttempt":{"attemptId":"attempt-1"}},"expected":{"outcome":"held","businessWriteCount":0,"recoveryClass":"RECOVERY_CLASS_RECONCILE_BEFORE_RETRY","automaticRetry":false,"collaborationCommandRequiredForStateChange":true}}
