{"schemaVersion":"v01-persistence-fixture/v0.1","fixtureId":"persistence-valid-coordinated-backup-manifest","category":"valid","requirementRefs":["C08-BACKUP-01","G4-07A-RECOVERY-02","QH-07"],"principal":{"kind":"BACKUP_COORDINATOR","principalId":"backup-coordinator","authenticated":true},"startingState":{"quiescenceBarrierId":"backup-barrier-1","requiredDomains":["TASK","COLLABORATION","HARNESS_ADAPTER","ARTIFACT_METADATA","VERIFICATION","FOUNDER_VERDICT","POLICY_DECISION"],"pendingOutboxCount":4,"liveArtifactBlobCount":12},"operation":{"createBackupManifest":{"backupId":"backup-1","domainSnapshotCount":7,"coveredBlobCount":12}},"expected":{"outcome":"ok","businessWriteCount":1,"requiredDomainsCovered":true,"pendingOutboxPreserved":true,"liveArtifactBlobsCovered":true,"derivedReadModelRequired":false,"manifestDigestCreated":true}}
