{"schemaVersion":"v01-persistence-fixture/v0.1","fixtureId":"persistence-valid-isolated-restore-cutover","category":"valid","requirementRefs":["C08-RESTORE-01","QH-07"],"principal":{"kind":"RECOVERY_COORDINATOR","principalId":"recovery-coordinator","authenticated":true},"startingState":{"backupId":"backup-1","restoreLocation":"isolated:restore-1","verificationReportValid":true,"activeStoreFenced":true},"operation":{"cutoverRestore":{"recoveryPlanId":"recovery-1","verificationReportId":"restore-report-1"}},"expected":{"outcome":"ok","businessWriteCount":0,"verifiedInIsolation":true,"inPlaceOverwrite":false,"atomicStoreSetCutover":true,"authorityBusinessWriteCount":0,"readModelRebuildRequired":true}}
