{"schemaVersion":"v01-persistence-fixture/v0.1","fixtureId":"persistence-valid-artifact-blob-before-metadata-seal","category":"valid","requirementRefs":["C08-BLOB-01","C04-DUR-01","QH-04"],"principal":{"kind":"DOMAIN_AUTHORITY","principalId":"artifact-authority","authenticated":true},"startingState":{"blobDigest":"sha256:artifact-1","blobDurable":true,"metadataSealed":false},"operation":{"sealArtifactMetadata":{"artifactId":"artifact-1","contentDigest":"sha256:artifact-1"}},"expected":{"outcome":"ok","businessWriteCount":1,"blobDurableBeforeMetadata":true,"metadataReferencesDigest":true,"orphanBlobMayBeCollectedLater":true}}
