{"schemaVersion":"v01-persistence-fixture/v0.1","fixtureId":"persistence-stale-backup-domain-watermark","category":"stale","requirementRefs":["C08-BACKUP-01"],"principal":{"kind":"BACKUP_COORDINATOR","principalId":"backup-coordinator","authenticated":true},"startingState":{"barrierWatermarkRevision":20,"snapshotWatermarkRevision":18},"operation":{"createBackupManifest":{"backupId":"backup-stale-watermark"}},"expected":{"outcome":"error","businessWriteCount":0,"errorCode":"PERSISTENCE_ERROR_CODE_REVISION_CONFLICT","manifestStatus":"BACKUP_STATUS_INCOMPLETE"}}
