{"schemaVersion":"v01-persistence-fixture/v0.1","fixtureId":"persistence-valid-compatible-migration-with-backup","category":"valid","requirementRefs":["C08-MIGRATION-01"],"principal":{"kind":"RECOVERY_COORDINATOR","principalId":"migration-coordinator","authenticated":true},"startingState":{"schemaVersion":"1.0","preMigrationBackupVerified":true,"writesFenced":true},"operation":{"migrateDomainStore":{"domain":"TASK","targetSchemaVersion":"1.1","migrationPlanRef":"migration-task-1-1"}},"expected":{"outcome":"ok","businessWriteCount":0,"schemaDigestBound":true,"preMigrationManifestVerified":true,"destructiveMigration":false,"readModelRebuildRequired":true}}
