{"schemaVersion":"v01-persistence-fixture/v0.1","fixtureId":"persistence-recovery-readmodel-checkpoint-gap-new-epoch","category":"recovery","requirementRefs":["C08-PROJECTION-02","C07-RECOVERY-01","QT-07"],"principal":{"kind":"RECOVERY_COORDINATOR","principalId":"recovery-coordinator","authenticated":true},"startingState":{"projectionEpoch":"projection-7","checkpointSequence":500,"firstRetainedEventSequence":520},"operation":{"rebuildReadModel":{"checkpointUsable":false}},"expected":{"outcome":"ok","businessWriteCount":0,"newProjectionEpoch":"projection-8","fullRebuild":true,"clientResetRequired":true,"authorityBusinessWriteCount":0}}
