{"schemaVersion":"v01-persistence-fixture/v0.1","fixtureId":"persistence-recovery-process-crash-after-ack-rpo-zero","category":"recovery","requirementRefs":["C08-FAULTMODEL-01","QH-07"],"principal":{"kind":"RECOVERY_COORDINATOR","principalId":"recovery-coordinator","authenticated":true},"startingState":{"fault":"PROCESS_CRASH_AFTER_ACK","durableMediaIntact":true,"acknowledgedRevision":31},"operation":{"beginRecovery":{"requiredDomains":["TASK"]}},"expected":{"outcome":"ok","businessWriteCount":0,"recoveredRevision":31,"acknowledgedCommitLost":false,"rpoSeconds":0,"faultModel":"PROCESS_OR_OS_CRASH_DURABLE_MEDIA_INTACT"}}
