{"schemaVersion":"v01-persistence-fixture/v0.1","fixtureId":"persistence-valid-read-model-rebuild-new-epoch","category":"valid","requirementRefs":["C08-PROJECTION-01","C07-RECOVERY-01","QT-07"],"principal":{"kind":"RECOVERY_COORDINATOR","principalId":"recovery-coordinator","authenticated":true},"startingState":{"oldProjectionEpoch":"projection-7","authorityStoresHealthy":true,"checkpointUsable":false},"operation":{"rebuildReadModel":{"fromAuthorityEvents":true}},"expected":{"outcome":"ok","businessWriteCount":0,"newProjectionEpoch":"projection-8","authorityBusinessWriteCount":0,"derivedStoreUsedAsFactSource":false,"clientsMustReset":true}}
