{"schemaVersion":"v01-persistence-fixture/v0.1","fixtureId":"persistence-valid-consumed-outbox-payload-purge","category":"valid","requirementRefs":["C08-RETENTION-01","QR-08"],"principal":{"kind":"DOMAIN_AUTHORITY","principalId":"task-authority","authenticated":true},"startingState":{"messageState":"CONSUMED","consumptionReceiptVerified":true,"retentionElapsed":true,"backupCoverageVerified":true},"operation":{"purgeConsumedOutboxPayload":{"messageId":"msg-consumed-1"}},"expected":{"outcome":"ok","businessWriteCount":0,"payloadPurged":true,"authorityEventRetained":true,"consumptionReceiptRetained":true,"auditContinuityPreserved":true}}
