{"schemaVersion":"v01-persistence-fixture/v0.1","fixtureId":"persistence-valid-authority-atomic-commit","category":"valid","requirementRefs":["C08-DUR-01","QH-07","QH-08"],"principal":{"kind":"DOMAIN_AUTHORITY","principalId":"task-authority","authenticated":true},"startingState":{"domain":"PERSISTENCE_DOMAIN_TASK","aggregateRevision":7,"storeEpoch":"task-store-1"},"operation":{"commitAuthorityMutation":{"expectedRevision":7,"eventId":"evt_task_8","outboxMessageIds":["msg_task_8_verdict"]}},"expected":{"outcome":"ok","businessWriteCount":1,"resultingRevision":8,"stateEventIdempotencyOutboxAtomic":true,"acknowledgedAfterDurabilityBarrier":true,"writeOwner":"TaskAuthority"}}
